[
  {
    "id": "CWE-049",
    "title": "CWE-049: Run the code in a jail or similar sandbox environment that enforces stri",
    "version": "1.0.0",
    "sourcePrinciples": [
      {
        "source": "CWE_Top25",
        "ref": "CWE-049",
        "text": "Run the code in a jail or similar sandbox environment that enforces strict boundaries between the process and the operating system."
      }
    ],
    "normativeText": "Run the code in a jail or similar sandbox environment that enforces strict boundaries between the process and the operating system.",
    "riskTags": [
      "filesystem_isolation",
      "process_isolation",
      "runtime_hardening",
      "sandboxing"
    ],
    "cweTags": [
      "CWE-22",
      "CWE-78"
    ],
    "taskTriggers": [
      "endpoint_runtime_hardening",
      "runtime_isolation"
    ],
    "inputChannels": [],
    "dangerousSinks": [],
    "assetTags": [],
    "trustBoundaryTags": [],
    "dependencyTags": [],
    "environmentTags": [
      "endpoint_runtime_hardening",
      "sandboxed_execution"
    ],
    "phaseBindings": [
      "final_reporting",
      "implementation",
      "inspection",
      "verification",
      "verification_runtime"
    ],
    "validators": [],
    "evidenceRequirements": [
      "command",
      "diff"
    ],
    "forbiddenWorkarounds": [
      "disable sandboxing to make the task pass"
    ],
    "severity": "fail_closed"
  },
  {
    "id": "CWE-067",
    "title": "CWE-067: Use quotas or other resource-limiting settings provided by the operating",
    "version": "1.0.0",
    "sourcePrinciples": [
      {
        "source": "CWE_Top25",
        "ref": "CWE-067",
        "text": "Use quotas or other resource-limiting settings provided by the operating system or environment."
      }
    ],
    "normativeText": "Use quotas or other resource-limiting settings provided by the operating system or environment.",
    "riskTags": [
      "runtime_hardening",
      "sandboxing"
    ],
    "cweTags": [
      "CWE-770"
    ],
    "taskTriggers": [
      "endpoint_runtime_hardening"
    ],
    "inputChannels": [],
    "dangerousSinks": [],
    "assetTags": [],
    "trustBoundaryTags": [],
    "dependencyTags": [],
    "environmentTags": [
      "endpoint_runtime_hardening"
    ],
    "phaseBindings": [
      "implementation",
      "inspection",
      "verification",
      "verification_runtime"
    ],
    "validators": [],
    "evidenceRequirements": [
      "command",
      "diff"
    ],
    "forbiddenWorkarounds": [],
    "severity": "fail_closed"
  },
  {
    "id": "CWE-079",
    "title": "CWE-079: Use the access control capabilities of your operating system and server ",
    "version": "1.0.0",
    "sourcePrinciples": [
      {
        "source": "CWE_Top25",
        "ref": "CWE-079",
        "text": "Use the access control capabilities of your operating system and server environment and define your access control lists accordingly. Use a default deny policy when defining these ACLs."
      }
    ],
    "normativeText": "Use the access control capabilities of your operating system and server environment and define your access control lists accordingly. Use a default deny policy when defining these ACLs.",
    "riskTags": [
      "access_control",
      "least_privilege"
    ],
    "cweTags": [
      "CWE-862",
      "CWE-863"
    ],
    "taskTriggers": [
      "least_privilege_access"
    ],
    "inputChannels": [],
    "dangerousSinks": [],
    "assetTags": [],
    "trustBoundaryTags": [],
    "dependencyTags": [],
    "environmentTags": [
      "least_privilege_access"
    ],
    "phaseBindings": [
      "implementation",
      "inspection",
      "verification"
    ],
    "validators": [],
    "evidenceRequirements": [
      "command",
      "diff"
    ],
    "forbiddenWorkarounds": [
      "broaden privileges instead of fixing authorization"
    ],
    "severity": "fail_closed"
  },
  {
    "id": "RMF-027",
    "title": "RMF-027: AI systems that can maintain confidentiality, integrity, and availabilit",
    "version": "1.0.0",
    "sourcePrinciples": [
      {
        "source": "NIST_AI_RMF",
        "ref": "RMF-027",
        "text": "AI systems that can maintain confidentiality, integrity, and availability through protection mechanisms that prevent unauthorized access and use may be said to be secure."
      }
    ],
    "normativeText": "AI systems that can maintain confidentiality, integrity, and availability through protection mechanisms that prevent unauthorized access and use may be said to be secure.",
    "riskTags": [
      "setup_security"
    ],
    "cweTags": [],
    "taskTriggers": [
      "other_setup_env"
    ],
    "inputChannels": [],
    "dangerousSinks": [],
    "assetTags": [],
    "trustBoundaryTags": [],
    "dependencyTags": [],
    "environmentTags": [
      "other_setup_env"
    ],
    "phaseBindings": [
      "implementation",
      "inspection",
      "verification"
    ],
    "validators": [],
    "evidenceRequirements": [
      "command",
      "diff"
    ],
    "forbiddenWorkarounds": [],
    "severity": "advisory"
  },
  {
    "id": "RMF-031",
    "title": "RMF-031: Maintaining the provenance of training data and supporting attribution o",
    "version": "1.0.0",
    "sourcePrinciples": [
      {
        "source": "NIST_AI_RMF",
        "ref": "RMF-031",
        "text": "Maintaining the provenance of training data and supporting attribution of the AI system’s decisions to subsets of training data can assist with both transparency and accountability."
      }
    ],
    "normativeText": "Maintaining the provenance of training data and supporting attribution of the AI system’s decisions to subsets of training data can assist with both transparency and accountability.",
    "riskTags": [
      "build_integrity",
      "dependency_integrity",
      "dependency_management",
      "release_integrity",
      "supply_chain"
    ],
    "cweTags": [],
    "taskTriggers": [
      "dependency_change",
      "dependency_supply_chain"
    ],
    "inputChannels": [
      "build",
      "package"
    ],
    "dangerousSinks": [],
    "assetTags": [
      "build_artifacts"
    ],
    "trustBoundaryTags": [],
    "dependencyTags": [
      "dependency_integrity"
    ],
    "environmentTags": [
      "dependency_management",
      "dependency_supply_chain"
    ],
    "phaseBindings": [
      "implementation",
      "inspection",
      "verification"
    ],
    "validators": [],
    "evidenceRequirements": [
      "command",
      "diff"
    ],
    "forbiddenWorkarounds": [
      "install unpinned or untrusted dependencies"
    ],
    "severity": "advisory"
  },
  {
    "id": "RMF-121",
    "title": "RMF-121: MANAGE 4.2: Measurable activities for continual improvements are integra",
    "version": "1.0.0",
    "sourcePrinciples": [
      {
        "source": "NIST_AI_RMF",
        "ref": "RMF-121",
        "text": "MANAGE 4.2: Measurable activities for continual improvements are integrated into AI system updates and include regular engagement with interested parties, including relevant AI actors."
      }
    ],
    "normativeText": "MANAGE 4.2: Measurable activities for continual improvements are integrated into AI system updates and include regular engagement with interested parties, including relevant AI actors.",
    "riskTags": [
      "setup_security"
    ],
    "cweTags": [],
    "taskTriggers": [
      "other_setup_env"
    ],
    "inputChannels": [],
    "dangerousSinks": [],
    "assetTags": [],
    "trustBoundaryTags": [],
    "dependencyTags": [],
    "environmentTags": [
      "other_setup_env"
    ],
    "phaseBindings": [
      "implementation",
      "inspection",
      "verification"
    ],
    "validators": [],
    "evidenceRequirements": [
      "command",
      "diff"
    ],
    "forbiddenWorkarounds": [],
    "severity": "advisory"
  },
  {
    "id": "SSDF-001",
    "title": "SSDF-001: Organizations should integrate the SSDF throughout their existing softwa",
    "version": "1.0.0",
    "sourcePrinciples": [
      {
        "source": "NIST_SP800218",
        "ref": "SSDF-001",
        "text": "Organizations should integrate the SSDF throughout their existing software development practices, express their secure software development requirements to third-party suppliers using SSDF conventions, and acquire software that meets the practices described in the SSDF."
      }
    ],
    "normativeText": "Organizations should integrate the SSDF throughout their existing software development practices, express their secure software development requirements to third-party suppliers using SSDF conventions, and acquire software that meets the practices described in the SSDF.",
    "riskTags": [
      "process_controls",
      "process_lifecycle"
    ],
    "cweTags": [],
    "taskTriggers": [
      "process_lifecycle"
    ],
    "inputChannels": [],
    "dangerousSinks": [],
    "assetTags": [],
    "trustBoundaryTags": [],
    "dependencyTags": [],
    "environmentTags": [
      "process_lifecycle"
    ],
    "phaseBindings": [
      "implementation",
      "inspection",
      "verification"
    ],
    "validators": [],
    "evidenceRequirements": [
      "command",
      "diff"
    ],
    "forbiddenWorkarounds": [],
    "severity": "advisory"
  },
  {
    "id": "SSDF-002",
    "title": "SSDF-002: Organizations should ensure that their people, processes, and technology",
    "version": "1.0.0",
    "sourcePrinciples": [
      {
        "source": "NIST_SP800218",
        "ref": "SSDF-002",
        "text": "Organizations should ensure that their people, processes, and technology are prepared to perform secure software development."
      }
    ],
    "normativeText": "Organizations should ensure that their people, processes, and technology are prepared to perform secure software development.",
    "riskTags": [
      "setup_security"
    ],
    "cweTags": [],
    "taskTriggers": [
      "other_setup_env"
    ],